<?xml version="1.0" encoding="UTF-8"?>
<diagram
  xmlns="http://BobbinWork.googlecode.com/bw.xsd"
  xmlns:xsi="http://www.w3.org/2001/XMLSchema-instance"
  xsi:schemaLocation="http://BobbinWork.googlecode.com bw.xsd"
  xmlns:xi="http://www.w3.org/2001/XInclude"
>
  <title>
    <value lang="en">Copyright 2009, J. Pol, some rights reserved: http://creativecommons.org/licenses/by/3.0/</value>
  </title>
  <xi:include href='http://bobbinwork.googlecode.com/svn/!svn/bc/709/trunk/src/main/resources/nl/BobbinWork/diagram/xml/basicStitches.xml'/>
  <group pairs="1-15" display="yes">
    <new_bobbins nrs="3-8,13-16"><style color="#0000FF"/></new_bobbins>
    <new_bobbins nrs="9-12"><style color="#FF0000"/></new_bobbins>
    <new_bobbins nrs="17-18,23-24"><style color="#993333"/></new_bobbins>
    <new_bobbins nrs="19-22"><style color="#44CC44" width="3"><shadow color="#DDFFDD" width="9"/></style></new_bobbins>
    <title>
      <value lang="nl">Opzet trapgevel</value>
      <value lang="nl">Start s staircase</value>
    </title>
    <copy of="bothGimps" pairs="10-11"><move x="300" y="110"/></copy>
    <group id="top" pairs="8-10">
      <title><value lang="en"> </value></title>
      <copy of="ffs" pairs="1-2"><move x="265" y="85"/></copy>
      <copy of="gRTL" pairs="2-3"><move x="287" y="110"/></copy>
      <copy of="gRTL" pairs="1-2"><move x="262" y="110"/></copy>
    </group>
    <group id="hoek" pairs="4-9">
      <title><value lang="en"> </value></title>
      <copy of="top" pairs="3-5"><move x="-60" y="0"/></copy>
      <copy of="vg" pairs="5-6"><move x="236" y="130"/></copy>
      <copy of="ffsL" pairs="1-2"><move x="135" y="90"/></copy>
      <copy of="gRTL" pairs="2-3"><rotate centre="0,5" angle="-50"/><move x="169" y="117"/></copy>
      <copy of="vg" pairs="3-4"><move x="181" y="130"/></copy>
      <copy of="vg" pairs="4-5"><move x="211" y="155"/></copy>
      <group pairs="1-3">
        <title>
          <value lang="nl">door sierdraad, randslag en terug</value>
        </title>
        <copy of="gLTR" pairs="2-3"><rotate centre="0,5" angle="90"/><move x="165" y="146"/></copy>
        <copy of="fs-1" pairs="1-2"><move x="133" y="156"/></copy>
        <copy of="gRTL" pairs="2-3"><rotate centre="0,5" angle="-90"/><move x="163" y="170"/></copy>
      </group>
      <copy of="vg" pairs="3-4"><move x="181" y="180"/></copy>
      <group pairs="1-3">
        <title>
          <value lang="nl">binnenhoek</value>
        </title>
        <copy of="gLTR" pairs="2-3"><rotate centre="2,9" angle="90"/><move x="165" y="188"/></copy>
        <group pairs="1-2">
          <group pairs="1-4">
            <title><value lang="en"> </value></title>
            <copy of="ll" pairs="1"><rotate centre="10,10" angle="45"/><move x="128" y="190"/></copy>
            <copy of="ffsLI" pairs="1-3"><move x="138" y="188"/></copy>
            <title><value lang="en"> </value></title>
            <copy of="gRTL" pairs="3-4"><rotate centre="0,5" angle="-60"/><move x="165" y="215"/></copy>
            <copy of="gRTL" pairs="2-3"><move x="141" y="224"/></copy>
          </group>
        </group>
      </group>
    </group>
    <group id="hoek1" pairs="8-13">
      <title><value lang="en"> </value></title>
      <copy of="ffsR" pairs="5-6"><move x="340" y="90"/></copy>
      <copy of="gLTR" pairs="4-5"><rotate centre="0,7" angle="45"/><move x="321" y="116"/></copy>
      <copy of="vg" pairs="3-4"><move x="295" y="130"/></copy>
      <group pairs="4-6">
        <title>
          <value lang="nl">door sierdraad, randslag en terug</value>
        </title>
        <copy of="gRTL" pairs="1-2"><rotate centre="0,7" angle="-90"/><move x="330" y="142"/></copy>
        <copy of="r" pairs="3"><rotate centre="10,10" angle="-45"/><move x="352" y="130"/></copy>
        <copy of="hs-r" pairs="2-3"><move x="348" y="155"/></copy>
        <pin position="342,163"/>
      </group>
    </group>
    <copy of="vg" pairs="9-10"><move x="265" y="155"/></copy>
    <copy of="vg" pairs="8-9"><move x="240" y="180"/></copy>
    <copy of="vg" pairs="7-8"><move x="215" y="205"/></copy>
    <copy of="hoek" pairs="1-5"><move x="-113" y="110"/></copy>
    <!-- hack: create space for the animation
    <copy of="l" pairs="3"><move x="90" y="380"/></copy>
     -->
  </group>
</diagram>
