<?xml version="1.0" encoding="UTF-8"?>
<diagram
  xmlns:xsi='http://www.w3.org/2001/XMLSchema-instance'
  xsi:noNamespaceSchemaLocation='http://www.xs4all.nl/~falkink/BobbinWork/bw.xsd'
>
<!-- Copyright 2008, J. Falkink-Pol
  
This file is part of BobbinWork.

BobbinWork is free software: you can redistribute it and/or modify
it under the terms of the GNU General Public License as published by
the Free Software Foundation, either version 3 of the License, or
(at your option) any later version.

BobbinWork is distributed in the hope that it will be useful,
but WITHOUT ANY WARRANTY; without even the implied warranty of
MERCHANTABILITY or FITNESS FOR A PARTICULAR PURPOSE.  See the
GNU General Public License for more details.
  
You should have received a copy of the GNU General Public License
along with BobbinWork.  If not, see <http://www.gnu.org/licenses/>.
  
 -->
  <group pairs="1-1" display="no">
    <group id="flanders"  pairs="1-4">
      <group pairs="1-4">
        <!-- NE --><copy of="tc"   pairs="1-2"><rotate centre="10,10" angle="-45"/></copy>
        <!-- NW --><copy of="tc"   pairs="3-4"><rotate centre="10,10" angle="45"/><move x="60"/></copy>
        <!-- N  --><copy of="tctc" pairs="2-3"><move y="10" x="30"/></copy>
        <pin position="38,40"/>
        <!-- E  --><copy of="tc"   pairs="1-2"><move y="30" x="10"/></copy>
        <!-- W  --><copy of="tc"   pairs="3-4"><move y="30" x="50"/></copy>
        <!-- S  --><copy of="tctc" pairs="2-3"><move y="50" x="30"/></copy>
      </group>
    </group>
    <group id="spider" pairs="1-6">
      <!-- 1 --><copy of="ttctc"  pairs="3-4"><move x="50" y="10"/></copy>
      <!-- 2 --><copy of="llctc"  pairs="2-3"><move x="28" y="33"/></copy>
      <!-- 3 --><copy of="llctc"  pairs="1-2"><move x="10" y="55"/></copy>
      
      <!-- 4 --><copy of="rctc"  pairs="4-5"><move x="73" y="33"/></copy>
      <!-- 5 --><copy of="ctc"  pairs="3-4"><move x="50" y="43"/></copy>
      <!-- 6 --><copy of="ctc"  pairs="2-3"><move x="30" y="63"/></copy>
      
      <!-- 7 --><copy of="rctc"  pairs="5-6"><move x="90" y="55"/></copy>
      <!-- 8 --><copy of="ctc"  pairs="4-5"><move x="70" y="63"/></copy>
      <!-- 9 --><copy of="ctc"  pairs="3-4"><move x="50" y="70"/></copy>
      
      <!-- 10 --><copy of="ctc"  pairs="3-4"><move x="50" y="100"/></copy>
      <pin position="58,93"/>
      <!-- 11 --><copy of="ctc"  pairs="2-3"><move x="30" y="108"/></copy>
      <!-- 12 --><copy of="ctc"  pairs="1-2"><move x="10" y="115"/></copy>
      
      <!-- 13 --><copy of="ctc"  pairs="4-5"><move x="70" y="108"/></copy>
      <!-- 14 --><copy of="ctc"  pairs="3-4"><move x="50" y="125"/></copy>
      <!-- 15 --><copy of="ctc"  pairs="2-3"><move x="28" y="138"/></copy>
      
      <!-- 16 --><copy of="ctc"  pairs="5-6"><move x="90" y="115"/></copy>
      <!-- 17 --><copy of="ctc"  pairs="4-5"><move x="73" y="138"/></copy>
      <!-- 18 --><copy of="ctc"  pairs="3-4"><move x="50" y="160"/></copy>
    </group>
    <group id="vierge" pairs="1-4">
      <copy of="ctc" pairs="1-2"><rotate centre="8.2,8.4" angle="-55"/><move x="60" y="15"/></copy>
      <copy of="ctc" pairs="3-4"><rotate centre="8.2,8.4" angle="55"/><move x="140" y="15"/></copy>
      <group id="top" pairs="2-3">
        <copy of="ctc"  pairs="1-2"><move x="100" y="0"/></copy>
        <copy of="ctc"  pairs="1-2"><move x="100" y="32"/></copy>
        <pin position="108,25" />
      </group>
      <group id="left" pairs="3-4">
        <copy of="ctc"  pairs="1-2"><move x="140" y="40"/></copy>
        <copy of="ctc"  pairs="1-2"><move x="140" y="72"/></copy>
        <pin position="148,65" />
      </group>
      <copy of="ctc" pairs="2-3"><rotate centre="8.2,8.4" angle="55"/><move x="100" y="57"/></copy>
      <group id="left" pairs="1-2">
        <copy of="ctc"  pairs="1-2"><move x="60" y="40"/></copy>
        <copy of="ctc"  pairs="1-2"><move x="60" y="72"/></copy>
        <pin position="68,65" />
      </group>
      <group id="top" pairs="2-3">
        <copy of="ctc"  pairs="1-2"><move x="100" y="80"/></copy>
        <copy of="ctc"  pairs="1-2"><move x="100" y="112"/></copy>
        <pin position="108,105" />
      </group>
    </group>
    <group id="sGravenmoers" pairs="1-4">
      <copy of="ctc" pairs="1-2"><rotate centre="8.2,8.4" angle="-55"/><move x="60" y="15"/></copy>
      <copy of="ctc" pairs="3-4"><rotate centre="8.2,8.4" angle="55"/><move x="140" y="15"/></copy>
      <group id="top" pairs="2-3">
        <copy of="ctc"  pairs="1-2"><move x="100" y="0"/></copy>
        <copy of="ctc"  pairs="1-2"><move x="100" y="32"/></copy>
        <pin position="108,25" />
      </group>
      <group id="centre" pairs="1-4">
        <copy of="ctc"  pairs="3-4"><move x="140" y="40"/></copy>
        <copy of="ctc"  pairs="1-2"><move x="60" y="40"/></copy>
        <copy of="ctc" pairs="2-3"><rotate centre="8.2,8.4" angle="55"/><move x="100" y="57"/></copy>

        <copy of="ctc"  pairs="3-4"><move x="140" y="72"/></copy>
        <pin position="148,65" />
        <copy of="ctc"  pairs="1-2"><move x="60" y="72"/></copy>
        <pin position="68,65" />
      </group>
      <group id="top" pairs="2-3">
        <copy of="ctc"  pairs="1-2"><move x="100" y="80"/></copy>
        <copy of="ctc"  pairs="1-2"><move x="100" y="112"/></copy>
        <pin position="108,105" />
      </group>
    </group>
  </group>
</diagram>