<?xml version="1.0" encoding="UTF-8"?>
<diagram
  xmlns="http://BobbinWork.googlecode.com/bw.xsd"
  xmlns:xsi="http://www.w3.org/2001/XMLSchema-instance"
  xsi:schemaLocation="http://BobbinWork.googlecode.com bw.xsd"
  xmlns:xi="http://www.w3.org/2001/XInclude"
>
  <!-- This file is licensed under http://creativecommons.org/licenses/by/3.0/ 
    -->
  <xi:include href='http://bobbinwork.googlecode.com/svn-history/r278/trunk/src/nl/BobbinWork/diagram/xml/basicStitches.xml'/>
  <group id="snow" pairs="32761-32766">
    <pin position="58,0"/>
    <pin position="0,43"/>
    <pin position="116,43"/>
    <!-- 1 --><copy of="ttctc"  pairs="3-4"><move x="50" y="10"/></copy>
    <!-- 2 --><copy of="llctc"  pairs="2-3"><move x="28" y="33"/></copy>
    <!-- 3 --><copy of="llctc"  pairs="1-2"><move x="10" y="55"/></copy>
     
    <!-- 4 --><copy of="rctc"  pairs="4-5"><move x="73" y="33"/></copy>

    <!-- 5 --><copy of="tc"  pairs="3-4"><move x="50" y="43"/></copy>
    <!-- 6 --><copy of="tc"  pairs="2-3"><move x="30" y="63"/></copy>
      
    <!-- 7 --><copy of="rctc"  pairs="5-6"><move x="90" y="55"/></copy>
    <!-- 8 --><copy of="tc"  pairs="4-5"><move x="70" y="63"/></copy>
    <!-- 9 --><copy of="tc"  pairs="3-4"><move x="50" y="82"/></copy>
      
    <!-- 11 --><copy of="tc"  pairs="2-3"><move x="30" y="95"/></copy>
    <!-- 12 --><copy of="rctc"  pairs="1-2"><move x="10" y="115"/></copy>
      
    <!-- 13 --><copy of="tc"  pairs="4-5"><move x="70" y="95"/></copy>
    <!-- 14 --><copy of="tc"  pairs="3-4"><move x="50" y="110"/></copy>

    <!-- 15 --><copy of="rctc"  pairs="2-3"><move x="28" y="138"/></copy>
      
    <!-- 16 --><copy of="lctc"  pairs="5-6"><move x="90" y="115"/></copy>
    <!-- 17 --><copy of="lctc"  pairs="4-5"><move x="73" y="138"/></copy>
    <!-- 18 --><copy of="ctc"  pairs="3-4"><move x="50" y="160"/></copy>
  </group>
  <group pairs='1-34'>
    <copy of='snow' pairs='31-36'/>
    <copy of='snow' pairs='13-18'><move x='408' y='0'/></copy>
    <copy of='snow' pairs='9-14'><move x='272' y='100'/></copy>

    <copy of='snow' pairs='5-10'><move x='136' y='200'/></copy>
    <copy of='snow' pairs='1-6'><move x='0' y='300'/></copy>
    <copy of='snow' pairs='17-22'><move x='544' y='100'/></copy>
    <copy of='snow' pairs='13-18'><move x='408' y='200'/></copy>
    <copy of='snow' pairs='9-14'><move x='272' y='300'/></copy>
    <copy of='snow' pairs='5-10'><move x='136' y='400'/></copy>
    <copy of='snow' pairs='21-26'><move x='680' y='200'/></copy>
    <copy of='snow' pairs='17-22'><move x='544' y='300'/></copy>
    <copy of='snow' pairs='13-18'><move x='408' y='400'/></copy>

    <copy of='snow' pairs='9-14'><move x='272' y='500'/></copy>
    <copy of='snow' pairs='25-30'><move x='816' y='300'/></copy>
    <copy of='snow' pairs='21-26'><move x='680' y='400'/></copy>
    <copy of='snow' pairs='17-22'><move x='544' y='500'/></copy>
    <copy of='snow' pairs='13-18'><move x='408' y='600'/></copy>
  </group>
</diagram>